{
  "$schema": "urn:mcgen:schema:tuple-evidence:1",
  "artifact": {
    "bytes": 1524,
    "entries": [
      "META-INF/MANIFEST.MF",
      "META-INF/mcgen-advanced-fields.json",
      "org/example/tuple/TupleProbe.class",
      "plugin.yml"
    ],
    "failures": [],
    "metadata": [
      {
        "format": "properties",
        "path": "plugin.yml",
        "valid": true,
        "values": {
          "description": "tuple probe",
          "id": "tuple-probe",
          "main": "org.example.tuple.TupleProbe",
          "name": "Tuple Probe",
          "version": "1.0.0"
        }
      }
    ],
    "path": "build/libs/tuple-probe-1.0.0.jar",
    "sha256": "de5287603f9dbd3ee1a2a886e5ea35ce7192f48282befa184bec07598961767a",
    "status": "passed",
    "warnings": []
  },
  "blockers": [],
  "build": {
    "commands": [
      {
        "command": [
          "./gradlew",
          "build"
        ],
        "diskBytes": 115679,
        "durationMs": 594,
        "exitCode": 0,
        "outputBytes": 645,
        "outputDigest": "dbe3b41017d14154efa585b3b754b1356704de05f17adc8dfe8a01a05e820a21"
      },
      {
        "command": [
          "./gradlew",
          "test"
        ],
        "diskBytes": 115679,
        "durationMs": 594,
        "exitCode": 0,
        "outputBytes": 612,
        "outputDigest": "e04e3c8798dd96d13f266fda5557d7dc9dd59023a76569f1d979d63312797121"
      }
    ],
    "finishedAt": "2026-08-13T05:31:40.298Z",
    "startedAt": "2026-08-10T00:00:00.000Z",
    "status": "passed"
  },
  "generatedAt": "2026-08-10T00:00:00.000Z",
  "generatorDigest": "8879f8877c750a514805276ca7bae91eb25e58766b2f64c5b8824de691c1d555",
  "invalidation": {
    "contentDigests": {
      "catalog": "b2876807318d44abc5fb63f1000c0ac8ea980d4e678ca55d78a23f0e0370eb72",
      "descriptor": "f9e74fab6f3843a5f421cd6d72ea50e58ef3925a0159f493987e469e0d1bf381",
      "fixture": "3f988960a45c509b3857f103232a20d44dc5886414c9e1ebe07b5a4a2a5436b9",
      "profile": "f2ae4856c04b94625e5402b47c03810ce6eb0549fd337d67f8fa50938a42de35",
      "template": "20092aa8aebcc9eee0dd27d06f3178a8198dbd118acf341687d9d37c2b13b43d"
    },
    "descriptorRevision": 3,
    "mappingDigest": "140bedbf9c3f6d56a9846d2ba7088798683f4da0c248231336e6a05679e4fdfe",
    "procedureDigest": "7c473d44d0d573d5122597d1f1c074dfc61831c7fcb037aa543b91a9e541ef58",
    "profileRevision": 4,
    "sourceDigests": [
      "9dc8e09d3bca0925c65487d3cbc2abf49730a343de3198403ef7ec5f492f8003",
      "cb509d4fdda4bcd098357f377e20c2f22a1aa6b6c38bd48d72fb1611b83c0251",
      "feab21f48be5ae8e9cd31716f11528f7f6b3415767a75d767e26227b250b5ad4"
    ],
    "wrapperSha256": "d53fe394c0477ef381323beb74b9b3f33e4e20bd82128dc77a8e55ed9f640583"
  },
  "key": {
    "digest": "e267f3a819771522d9757d3e5ee6f45abb1c60d4747fa4a279e1bbbabf3888e3",
    "identity": {
      "buildSystem": "gradle",
      "catalogKey": "1.8.8",
      "catalogSnapshotId": "2026-08-11-r1",
      "components": {
        "spigot": "org.spigotmc:spigot-api:1.8.8-R0.1-SNAPSHOT"
      },
      "contentDigests": {
        "catalog": "b2876807318d44abc5fb63f1000c0ac8ea980d4e678ca55d78a23f0e0370eb72",
        "descriptor": "f9e74fab6f3843a5f421cd6d72ea50e58ef3925a0159f493987e469e0d1bf381",
        "fixture": "3f988960a45c509b3857f103232a20d44dc5886414c9e1ebe07b5a4a2a5436b9",
        "profile": "f2ae4856c04b94625e5402b47c03810ce6eb0549fd337d67f8fa50938a42de35",
        "template": "20092aa8aebcc9eee0dd27d06f3178a8198dbd118acf341687d9d37c2b13b43d"
      },
      "descriptorId": "spigot-legacy",
      "descriptorRevision": 3,
      "family": "spigot-legacy",
      "fixtureId": "spigot-legacy.spigot-legacy.minimal-java.java.gradle.kotlin",
      "gradleDsl": "kotlin",
      "java": {
        "distribution": "temurin",
        "runtime": 8
      },
      "mappingDigest": "140bedbf9c3f6d56a9846d2ba7088798683f4da0c248231336e6a05679e4fdfe",
      "procedureDigest": "7c473d44d0d573d5122597d1f1c074dfc61831c7fcb037aa543b91a9e541ef58",
      "profileId": "spigot-legacy",
      "profileRevision": 4,
      "sourceDigests": [
        "9dc8e09d3bca0925c65487d3cbc2abf49730a343de3198403ef7ec5f492f8003",
        "cb509d4fdda4bcd098357f377e20c2f22a1aa6b6c38bd48d72fb1611b83c0251",
        "feab21f48be5ae8e9cd31716f11528f7f6b3415767a75d767e26227b250b5ad4"
      ],
      "sourceLanguage": "java",
      "wrapper": {
        "distributionSha256": "bed1da33cca0f557ab13691c77f38bb67388119e4794d113e051039b80af9bb1",
        "distributionUrl": "https://services.gradle.org/distributions/gradle-7.6.4-bin.zip",
        "kind": "launcher-script",
        "sha256": "d53fe394c0477ef381323beb74b9b3f33e4e20bd82128dc77a8e55ed9f640583",
        "version": "7.6.4"
      }
    }
  },
  "outputTreeDigest": "6c794dd2d7fb030d23881f55e83aa439ccce6f0f6dc6dcf920039256bde80ff5",
  "reproducibility": {
    "differences": [],
    "firstDigest": "6c794dd2d7fb030d23881f55e83aa439ccce6f0f6dc6dcf920039256bde80ff5",
    "reproducible": true,
    "secondDigest": "6c794dd2d7fb030d23881f55e83aa439ccce6f0f6dc6dcf920039256bde80ff5"
  },
  "schemaVersion": 1,
  "status": "verified"
}
